{
  "id": "last-day-of-summer",
  "title": "The Last Day of Summer",
  "author": "ReadingPlanet Staff",
  "type": "story",
  "genre": "realistic-fiction",
  "lexile": 680,
  "wordCount": 520,
  "readingTime": 5,
  "coverEmoji": "🌅",
  "coverColor": "#f97316",
  "summary": "Marcus faces the end of summer and must say goodbye to his best friend who is moving away.",
  "vocabulary": [
    {
      "word": "bittersweet",
      "definition": "a feeling that is both happy and sad at the same time",
      "sentence": "Saying goodbye to his friend was bittersweet for Marcus."
    },
    {
      "word": "reluctantly",
      "definition": "in a way that shows unwillingness or hesitation",
      "sentence": "Marcus reluctantly packed up his things, not wanting the day to end."
    },
    {
      "word": "horizon",
      "definition": "the line where the earth or sea seems to meet the sky",
      "sentence": "The sun slowly sank toward the horizon."
    }
  ],
  "content": [
    {
      "type": "paragraph",
      "text": "Marcus sat on the dock, his feet dangling over the still lake water. Tomorrow, everything would change. School would start. His best friend Damon would be gone. The summer of endless bike rides, video game marathons, and late-night conversations would become just a memory."
    },
    {
      "type": "paragraph",
      "text": "\"You're thinking too much again,\" Damon said, dropping down beside him. \"I can tell by your face.\""
    },
    {
      "type": "paragraph",
      "text": "\"I'm not thinking. I'm just... looking at the water.\""
    },
    {
      "type": "paragraph",
      "text": "Damon laughed. \"Sure. And I'm not about to move 800 miles away tomorrow.\" He picked up a stone and skipped it across the glassy surface. Four skips before it sank. \"Remember when you couldn't skip rocks at all?\""
    },
    {
      "type": "paragraph",
      "text": "Marcus smiled despite himself. \"You hit me in the head with one. Three times.\""
    },
    {
      "type": "paragraph",
      "text": "\"It was twice, and you moved into the path.\" Damon found another flat stone. \"Here. Your turn.\""
    },
    {
      "type": "paragraph",
      "text": "Marcus took the stone. It was smooth and warm from sitting in the sun. He flicked his wrist the way Damon had taught him years ago. The stone bounced five times across the water. A new personal best."
    },
    {
      "type": "paragraph",
      "text": "\"See?\" Damon said. \"You'll be fine without me.\""
    },
    {
      "type": "paragraph",
      "text": "\"That's not—\" Marcus started, then stopped. They both knew that wasn't the point."
    },
    {
      "type": "paragraph",
      "text": "The sun was sinking toward the horizon now, painting the sky in shades of orange and pink. They had watched countless sunsets from this dock over the years. This would be their last one together for a long time."
    },
    {
      "type": "paragraph",
      "text": "\"You know we can video chat,\" Damon said quietly. \"And there's winter break. My mom already said you could visit.\""
    },
    {
      "type": "paragraph",
      "text": "\"Yeah.\" Marcus's voice came out rough. \"It won't be the same though.\""
    },
    {
      "type": "paragraph",
      "text": "\"No,\" Damon agreed. \"But maybe that's okay. Different doesn't have to mean worse.\" He paused. \"My dad says change is just life's way of making room for new adventures.\""
    },
    {
      "type": "paragraph",
      "text": "Marcus wasn't sure he believed that. But sitting here next to his best friend, watching the sun melt into the water, he could almost imagine it might be true. Tomorrow would bring a new school year, new challenges, and the empty space where Damon used to be. But it would also bring possibilities he couldn't see yet."
    },
    {
      "type": "paragraph",
      "text": "\"Race you back to the house?\" Damon asked, already getting to his feet."
    },
    {
      "type": "paragraph",
      "text": "Marcus stood up slowly, taking one last look at the darkening water. \"You always cheat.\""
    },
    {
      "type": "paragraph",
      "text": "\"I call it strategic advantage.\" Damon grinned. \"Ready?\""
    },
    {
      "type": "paragraph",
      "text": "Marcus nodded. Whatever tomorrow brought, he would face it. But tonight, he still had his best friend, a summer sunset, and one last race to run."
    },
    {
      "type": "paragraph",
      "text": "\"Go!\""
    }
  ],
  "comprehension": [
    {
      "question": "Why is Marcus feeling sad at the beginning of the story?",
      "type": "multiple-choice",
      "options": [
        "His best friend Damon is moving away",
        "He failed his summer classes",
        "His family is getting a divorce",
        "He broke his bicycle"
      ],
      "correctIndex": 0
    },
    {
      "question": "What does the stone skipping scene reveal about Marcus and Damon's friendship?",
      "type": "multiple-choice",
      "options": [
        "They just met recently",
        "They have shared a long history together",
        "They don't really like each other",
        "Damon is better at everything"
      ],
      "correctIndex": 1
    },
    {
      "question": "What does Damon's dad mean when he says 'change is just life's way of making room for new adventures'?",
      "type": "multiple-choice",
      "options": [
        "You should move to a new place often",
        "Adventures are more important than friends",
        "Change can lead to new opportunities and experiences",
        "Life is always difficult"
      ],
      "correctIndex": 2
    },
    {
      "question": "How does Marcus's mood change by the end of the story?",
      "type": "multiple-choice",
      "options": [
        "He becomes even more sad and hopeless",
        "He becomes slightly more hopeful about the future",
        "He becomes angry at Damon",
        "He decides to move away too"
      ],
      "correctIndex": 1
    },
    {
      "question": "What is the theme of this story?",
      "type": "multiple-choice",
      "options": [
        "Competition makes people enemies",
        "Moving away is always bad",
        "Friendship can survive change",
        "Summer is the best season"
      ],
      "correctIndex": 2
    }
  ]
}
